{
  "name": "sap-btp-master-data-integration",
  "description": "Configures and integrates SAP Master Data Integration (MDI) service on SAP Business Technology Platform. Use when setting up MDI tenants, connecting applications (S/4HANA, SuccessFactors, Ariba, Fieldglass, etc.), configuring distribution models, SOAP APIs for business partners, extensibility, or troubleshooting master data replication. Covers One Domain Model integration, Business Data Orchestration, client authentication (OAuth2, mTLS), and security configurations.",
  "version": "2.3.0",
  "author": {
    "name": "E.J."
  },
  "license": "GPL-3.0",
  "repository": "https://github.com/secondsky/sap-skills",
  "keywords": [
    "api",
    "authentication",
    "btp",
    "cloud foundry",
    "cloud platform",
    "data",
    "hana",
    "integration",
    "kyma",
    "master",
    "oauth",
    "sap",
    "sap-btp-master-data-integration"
  ],
  "category": "btp",
  "commands": [
    "./commands/mdi-replication-check.md"
  ]
}
