{
  "name": "sap-hana-ml",
  "description": "SAP HANA Machine Learning Python Client (hana-ml) development skill. Use when: Building ML solutions with SAP HANA's in-database machine learning using Python hana-ml library for PAL/APL algorithms, DataFrame operations, AutoML, model persistence, and visualization. Keywords: hana-ml, SAP HANA, machine learning, PAL, APL, predictive analytics, HANA DataFrame, ConnectionContext, classification, regression, clustering, time series, ARIMA, gradient boosting, AutoML, SHAP, model storage",
  "version": "2.2.2",
  "author": {
    "name": "E.J.",
    "email": "maintainers@example.com"
  },
  "license": "GPL-3.0",
  "repository": "https://github.com/secondsky/sap-skills",
  "keywords": [
    "cloud",
    "database",
    "hana",
    "hdi",
    "python",
    "sap",
    "sap-hana-ml",
    "sql",
    "sqlscript"
  ],
  "category": "hana"
}
