{
  "name": "sap-btp-best-practices",
  "description": "Production-ready SAP BTP best practices for enterprise architecture, account management, security, and operations. Use when planning BTP implementations, setting up account hierarchies, configuring environments, implementing authentication, designing CI/CD pipelines, establishing governance, building Platform Engineering teams, implementing failover strategies, or managing application lifecycle on SAP BTP. Keywords: SAP BTP, account hierarchy, global account, directory, subaccount, Cloud Foundry, Kyma, ABAP, SAP Identity Authentication, CI/CD, governance, Platform Engineering, failover, multi-region, SAP BTP best practices",
  "version": "2.3.0",
  "author": {
    "name": "E.J.",
    "email": "maintainers@example.com"
  },
  "license": "GPL-3.0",
  "repository": "https://github.com/secondsky/sap-skills",
  "keywords": [
    "abap",
    "authentication",
    "best",
    "btp",
    "cloud foundry",
    "cloud platform",
    "kyma",
    "practices",
    "production",
    "sap",
    "sap-btp-best-practices"
  ],
  "category": "btp",
  "commands": [
    "./commands/btp-architecture-review.md"
  ]
}
