{
  "name": "sap-btp-connectivity",
  "description": "SAP BTP Connectivity skill covering Destination Service, Connectivity Service, Cloud Connector, Connectivity Proxy, and Transparent Proxy for Kubernetes. Use when configuring destinations (HTTP, RFC, LDAP, MAIL, TCP), setting up cloud-to-on-premise connectivity, implementing OAuth and principal propagation, deploying connectivity proxies in Kubernetes/Kyma, troubleshooting connectivity errors (405, 407, 503), or configuring multitenancy.",
  "version": "2.2.2",
  "author": {
    "name": "E.J.",
    "email": "maintainers@example.com"
  },
  "license": "GPL-3.0",
  "repository": "https://github.com/secondsky/sap-skills",
  "keywords": [
    "btp",
    "cloud foundry",
    "cloud platform",
    "connectivity",
    "http",
    "kyma",
    "oauth",
    "sap",
    "sap-btp-connectivity"
  ],
  "category": "btp"
}
