{
  "name": "sap-datasphere",
  "description": "SAP Datasphere development skill with 3 specialized agents, 5 slash commands, and validation hooks. Use when building data warehouses on SAP BTP, creating analytic models, configuring data flows and replication flows, setting up connections, managing spaces and users, implementing data access controls, using the datasphere CLI, or inspecting authenticated Datasphere browser UI state with Microsoft Edge CDP. Covers Data Builder, Business Builder, analytic models, 40+ connection types, real-time replication, task chains, content transport, and data marketplace.",
  "version": "2.4.1",
  "author": {
    "name": "Eduard Jiglau",
    "email": "hello@sap-ai-skills.com",
    "url": "https://sap-ai-skills.com"
  },
  "license": "GPL-3.0",
  "homepage": "https://sap-ai-skills.com",
  "repository": "https://github.com/secondsky/sap-skills",
  "keywords": [
    "analytics",
    "btp",
    "dashboard",
    "data",
    "datasphere",
    "edge",
    "sac",
    "sap",
    "sap-datasphere",
    "visualization"
  ],
  "category": "data-analytics",
  "agents": [
    "./agents/datasphere-integration-advisor.md",
    "./agents/datasphere-admin-helper.md",
    "./agents/datasphere-modeler.md"
  ],
  "commands": [
    "./commands/datasphere-cli.md",
    "./commands/datasphere-connection-guide.md",
    "./commands/datasphere-space-template.md",
    "./commands/datasphere-view-template.md",
    "./commands/datasphere-mcp-tools.md"
  ],
  "mcpServers": "./.mcp.json"
}
