{
  "name": "sap-btp-cloud-identity-services",
  "description": "SAP Cloud Identity Services for BTP applications: Identity Authentication (IAS), Identity Provisioning (IPS), and Authorization Management (AMS). Use when configuring authentication for BTP apps, setting up OIDC or SAML app registrations, federating corporate identity providers, establishing subaccount trust, provisioning users, writing AMS authorization policies, migrating from XSUAA to IAS-based authentication, or troubleshooting token and trust errors.",
  "version": "2.3.1",
  "author": {
    "name": "Eduard Jiglau",
    "email": "hello@sap-ai-skills.com",
    "url": "https://sap-ai-skills.com"
  },
  "license": "GPL-3.0",
  "homepage": "https://sap-ai-skills.com",
  "repository": "https://github.com/secondsky/sap-skills",
  "keywords": [
    "authentication",
    "authorization",
    "btp",
    "cloud",
    "cloud foundry",
    "cloud platform",
    "identity",
    "kyma",
    "saml",
    "sap",
    "sap-btp-cloud-identity-services",
    "services"
  ],
  "category": "btp",
  "agents": [
    "./agents/identity-security-advisor.md"
  ],
  "commands": [
    "./commands/identity-trust-check.md"
  ]
}
