{
  "name": "sap-btp-cias",
  "description": "SAP BTP Cloud Integration Automation Service (CIAS) skill for guided integration workflows. Use when: setting up CIAS subscriptions, configuring destinations, assigning roles (CIASIntegrationAdministrator, CIASIntegrationExpert, CIASIntegrationMonitor), planning integration scenarios, working with My Inbox tasks, monitoring scenario execution, troubleshooting CIAS errors, creating OAuth2 instances, configuring identity providers for CIAS, understanding CIAS security architecture, or integrating SAP products (S/4HANA, SuccessFactors, BTP services, SAP Build, IBP).",
  "version": "2.3.2",
  "author": {
    "name": "Eduard Jiglau",
    "email": "hello@sap-ai-skills.com",
    "url": "https://sap-ai-skills.com"
  },
  "license": "GPL-3.0",
  "homepage": "https://sap-ai-skills.com",
  "repository": "https://github.com/secondsky/sap-skills",
  "keywords": [
    "btp",
    "cias",
    "cloud foundry",
    "cloud platform",
    "hana",
    "kyma",
    "oauth",
    "sap",
    "sap-btp-cias"
  ],
  "category": "btp",
  "commands": [
    "./commands/cias-scenario-check.md"
  ]
}
