{
  "name": "sap-abap-cds",
  "description": "Comprehensive SAP ABAP CDS (Core Data Services) reference for data modeling, view development, and semantic enrichment. Use when creating CDS views or view entities, defining data models with annotations, working with associations and cardinality, implementing input parameters, using built-in functions, writing CASE expressions, implementing access control with DCL, handling CURR/QUAN data types, troubleshooting CDS errors, querying CDS views from ABAP, or displaying data with SALV IDA. Covers ABAP 7.4+ through ABAP Cloud.",
  "version": "2.3.1",
  "author": {
    "name": "Eduard Jiglau",
    "email": "hello@sap-ai-skills.com",
    "url": "https://sap-ai-skills.com"
  },
  "license": "GPL-3.0",
  "homepage": "https://sap-ai-skills.com",
  "repository": "https://github.com/secondsky/sap-skills",
  "keywords": [
    "abap",
    "abap cloud",
    "cds",
    "internal tables",
    "oop",
    "rap",
    "sap",
    "sap-abap-cds"
  ],
  "category": "abap",
  "commands": [
    "./commands/abap-cds-model-check.md"
  ]
}
