{
  "name": "sap-fiori-tools",
  "description": "Develops SAP Fiori applications using SAP Fiori tools extensions for VS Code and SAP Business Application Studio. Use when: generating Fiori Elements or Freestyle SAPUI5 applications, configuring Page Editor for List Report or Object Page, working with annotations and Service Modeler, setting up deployment to ABAP or Cloud Foundry, creating adaptation projects, using Guided Development, previewing with mock data or live data, configuring SAP Fiori launchpad, or using AI-powered generation with Project Accelerator/Joule. Technologies: SAP Fiori Elements, SAPUI5, OData V2/V4, CAP, SAP BTP, ABAP, Cloud Foundry, fiori-mcp-server (MCP tools for AI-assisted generation).",
  "version": "2.3.2",
  "author": {
    "name": "Eduard Jiglau",
    "email": "hello@sap-ai-skills.com",
    "url": "https://sap-ai-skills.com"
  },
  "license": "GPL-3.0",
  "homepage": "https://sap-ai-skills.com",
  "repository": "https://github.com/secondsky/sap-skills",
  "keywords": [
    "abap",
    "btp",
    "cap",
    "cloud foundry",
    "components",
    "deployment",
    "fiori",
    "frontend",
    "mvc",
    "odata",
    "sap",
    "sap-fiori-tools",
    "sapui5",
    "tools"
  ],
  "category": "ui-development",
  "agents": [
    "./agents/fiori-app-advisor.md"
  ],
  "commands": [
    "./commands/fiori-app-generate.md",
    "./commands/fiori-preview-deploy.md"
  ],
  "mcpServers": "./.mcp.json"
}
