{
  "name": "sap-btp-service-manager",
  "description": "This skill provides comprehensive knowledge for SAP Service Manager on SAP Business Technology Platform (BTP). It should be used when managing service instances, bindings, brokers, and platforms across Cloud Foundry, Kyma, Kubernetes, and other environments. Use when provisioning services via SMCTL CLI, BTP CLI, or REST APIs, configuring OAuth2 authentication, working with the SAP BTP Service Operator in Kubernetes, troubleshooting service consumption issues, or implementing cross-environment service management. Keywords: SAP Service Manager, BTP, service instances, service bindings, SMCTL, service broker, OSBAPI, Cloud Foundry, Kyma, Kubernetes, service-manager, service-operator-access, subaccount-admin, OAuth2, X.509, service marketplace, service plans, rate limiting, cf create-service, btp create services/instance, ServiceInstance CRD, ServiceBinding CRD",
  "version": "2.3.2",
  "author": {
    "name": "Eduard Jiglau",
    "email": "hello@sap-ai-skills.com",
    "url": "https://sap-ai-skills.com"
  },
  "license": "GPL-3.0",
  "homepage": "https://sap-ai-skills.com",
  "repository": "https://github.com/secondsky/sap-skills",
  "keywords": [
    "api",
    "authentication",
    "btp",
    "cloud foundry",
    "cloud platform",
    "edge",
    "kyma",
    "manager",
    "oauth",
    "rest",
    "sap",
    "sap-btp-service-manager",
    "service"
  ],
  "category": "btp",
  "commands": [
    "./commands/btp-service-manager-troubleshoot.md"
  ]
}
