{
  "name": "sap-bw-query",
  "description": "Use when automating SAP BW query inspection, InfoProvider metadata reads (characteristics, key figures), metadata-verified specification review, unsaved draft preparation, or human-confirmed query draft population through Eclipse or HANA Studio with BW Modeling Tools.",
  "version": "2.4.1",
  "author": {
    "name": "Eduard Jiglau",
    "email": "hello@sap-ai-skills.com",
    "url": "https://sap-ai-skills.com"
  },
  "license": "GPL-3.0",
  "homepage": "https://sap-ai-skills.com",
  "repository": "https://github.com/secondsky/sap-skills",
  "keywords": [
    "analytics",
    "dashboard",
    "data",
    "hana",
    "query",
    "sac",
    "sap",
    "sap-bw-query",
    "visualization"
  ],
  "category": "data-analytics",
  "commands": [
    "./commands/bw-studio-deploy.md",
    "./commands/bw-query-spec-review.md",
    "./commands/bw-query-draft.md",
    "./commands/bw-query-review.md",
    "./commands/bw-query-explain.md"
  ],
  "mcpServers": "./.mcp.json"
}
